{
  "$schema": "https://json-schema.org/draft/2020-12/schema",
  "$id": "https://loomtracer.local/schemas/v0/decision.proposed.json",
  "title": "decision.proposed event",
  "type": "object",
  "additionalProperties": false,
  "required": ["event_uuid", "type", "actor_id", "source", "payload"],
  "properties": {
    "event_id": { "type": ["integer", "null"], "minimum": 1 },
    "event_uuid": { "type": "string", "format": "uuid" },
    "correlation_id": { "type": ["string", "null"], "minLength": 1 },
    "causation_event_id": { "type": ["integer", "null"], "minimum": 1 },
    "type": { "const": "decision.proposed" },
    "actor_id": { "type": "string", "minLength": 1 },
    "source": { "enum": ["cli", "agent", "human", "slack", "document", "api"] },
    "source_ref": { "type": ["string", "null"], "minLength": 1 },
    "ts": { "type": ["string", "null"], "format": "date-time" },
    "payload": {
      "type": "object",
      "additionalProperties": false,
      "required": ["decision_id", "title", "rationale", "topic_keys", "option_ids", "chosen_option_id", "hypothesis_ids", "evidence_ids"],
      "properties": {
        "decision_id": { "$ref": "#/$defs/id" },
        "title": { "type": "string", "minLength": 1 },
        "rationale": { "type": "string", "minLength": 1 },
        "topic_keys": { "$ref": "#/$defs/id_array" },
        "option_ids": { "$ref": "#/$defs/id_array" },
        "option_labels": {
          "type": "array",
          "items": { "type": "string", "minLength": 1 },
          "description": "Human-readable label per option_ids entry, index-aligned. Omitted or empty on events predating this field."
        },
        "option_descriptions": {
          "type": "array",
          "items": { "type": "string", "minLength": 1 },
          "description": "Human-readable description per option_ids entry, index-aligned with option_labels. Omitted or empty on events predating this field."
        },
        "chosen_option_id": { "anyOf": [{ "$ref": "#/$defs/id" }, { "type": "null" }] },
        "hypothesis_ids": { "$ref": "#/$defs/id_array" },
        "evidence_ids": { "$ref": "#/$defs/id_array" },
        "expressed_confidence": {
          "type": "string",
          "minLength": 1,
          "description": "Confidence in the decider's own words: low, medium or high (validated by the commands layer at capture). Omitted when the decider stated none; never system-computed."
        },
        "quote": {
          "type": "string",
          "minLength": 1,
          "description": "Verbatim words of the decider, self-contained. Requires question."
        },
        "question": {
          "type": "string",
          "minLength": 1,
          "description": "The question this decision answers, in the capturer's own words. Required when quote is present (a quote is unreadable without the question it answers); may stand alone. The write path also resolves it to a Question node (question.recorded + relation.added ANSWERS)."
        },
        "project": {
          "type": "string",
          "minLength": 1,
          "description": "Registered project handle the decision is filed under. Omitted means no handle was given (project_source is then personal_fallback) or the event predates the field; the projector derives the recorder's personal project from actor_id, it is never stored."
        },
        "project_source": {
          "enum": ["stated", "folder_marker", "rig", "current_project", "job", "personal_fallback", "moved", "inherited"],
          "description": "How project was determined. Omitted on events predating this field; the write layer records personal_fallback whenever no project handle is given, and inherited on a replacement that states no project and takes the project the decision it replaces is filed in."
        },
        "binds": {
          "$ref": "#/$defs/binds",
          "description": "What the capturer said the decision binds beyond the edit in front of them. Omitted means not asked: every event before this field, a raw emit, classifier ingest, document import and Slack. Recorded together with undo_cost or not at all."
        },
        "undo_cost": {
          "$ref": "#/$defs/undo_cost",
          "description": "What the capturer said undoing the decision would cost. Omitted means not asked. Recorded together with binds or not at all."
        }
      },
      "dependentRequired": {
        "binds": ["undo_cost"],
        "undo_cost": ["binds"]
      }
    }
  },
  "$defs": {
    "binds": {
      "type": "object",
      "additionalProperties": false,
      "required": ["level"],
      "properties": {
        "level": { "enum": ["nothing", "something"] },
        "statement": { "type": "string", "minLength": 1, "description": "One sentence saying what it binds. Present exactly when level is something." }
      },
      "oneOf": [
        { "properties": { "level": { "const": "nothing" } }, "not": { "required": ["statement"] } },
        { "properties": { "level": { "const": "something" } }, "required": ["statement"] }
      ]
    },
    "undo_cost": {
      "type": "object",
      "additionalProperties": false,
      "required": ["level"],
      "properties": {
        "level": { "enum": ["cheap", "costly"] },
        "statement": { "type": "string", "minLength": 1, "description": "One sentence saying what undoing it costs. Present exactly when level is costly." }
      },
      "oneOf": [
        { "properties": { "level": { "const": "cheap" } }, "not": { "required": ["statement"] } },
        { "properties": { "level": { "const": "costly" } }, "required": ["statement"] }
      ]
    },
    "id": { "type": "string", "minLength": 1 },
    "id_array": {
      "type": "array",
      "items": { "$ref": "#/$defs/id" },
      "uniqueItems": true
    }
  }
}
